{"$schema":"https://json-schema.org/draft/2020-12/schema","$id":"schemas/patch-manifest.schema.json","type":"object","additionalProperties":false,"required":["schema_version","artifact","repository_id","base_snapshot_sha256","target_snapshot_sha256","changes","content_blobs"],"properties":{"schema_version":{"const":"1.0.0"},"artifact":{"const":"patch-manifest"},"repository_id":{"type":"string","pattern":"^sha256:[0-9a-f]{64}$"},"base_snapshot_sha256":{"type":"string","pattern":"^sha256:[0-9a-f]{64}$"},"target_snapshot_sha256":{"type":"string","pattern":"^sha256:[0-9a-f]{64}$"},"changes":{"type":"array","items":{"$ref":"schemas/change-record.schema.json"}},"content_blobs":{"type":"array","items":{"type":"object","additionalProperties":false,"required":["content_sha256","size_bytes","controller_blob_id"],"properties":{"content_sha256":{"type":"string","pattern":"^sha256:[0-9a-f]{64}$"},"size_bytes":{"type":"integer","minimum":0},"controller_blob_id":{"type":"string","pattern":"^BLOB-[A-Za-z0-9_.:-]+$"}}}}}}
