{"artifact":"patch-manifest","base_snapshot_sha256":"sha256:aaaaaaaaaaaaaaaaaaaaaaaaaaaaaaaaaaaaaaaaaaaaaaaaaaaaaaaaaaaaaaaa","changes":[],"content_blobs":[],"repository_id":"sha256:bbbbbbbbbbbbbbbbbbbbbbbbbbbbbbbbbbbbbbbbbbbbbbbbbbbbbbbbbbbbbbbb","schema_version":"1.0.0","target_snapshot_sha256":"sha256:cccccccccccccccccccccccccccccccccccccccccccccccccccccccccccccccc"}
